{"id":"653673ed-ef9d-4987-a0cb-d9b017de4bbc","status":"ready","updated":{"license":"2023-01-14T14:02:43Z","status":"2023-01-14T14:02:43Z"},"message":"ready","links":[{"rel":"license","href":"http://192.168.0.42:8991/api/v1/licenses/653673ed-ef9d-4987-a0cb-d9b017de4bbc","type":"application/vnd.readium.lcp.license.v1.0+json"},{"rel":"register","href":"http://192.168.0.42:8990/licenses/653673ed-ef9d-4987-a0cb-d9b017de4bbc/register{?id,name}","type":"application/vnd.readium.license.status.v1.0+json","templated":true},{"rel":"return","href":"http://192.168.0.42:8990/licenses/653673ed-ef9d-4987-a0cb-d9b017de4bbc/return{?id,name}","type":"application/vnd.readium.license.status.v1.0+json","templated":true},{"rel":"renew","href":"https://www.google.com","type":"text/html"}],"potential_rights":{"end":"2023-02-13T14:02:43Z"}}
